"Selection and Resource Allocation Strategies for Chatbot Technologies in Higher Education: An Optimization Model Approach","S. Wu; M. Luo","School of Economics and Management, Nanjing Polytechnic Institute, Luhe, Nanjing, China; School of Management, Shenzhen Institute of Information Technology, Longgang, Shenzhen, China",IEEE Access,"24 Jan 2025","2025","13","","13156","13174","Chatbot technologies are increasingly integral to higher education, offering significant potential to enhance teaching effectiveness and student engagement. This study explores the strategic integration of chatbot technologies, focusing on optimal selection and resource allocation to maximize educational efficacy. We developed a mathematical optimization model and introduced the “Relative Net Utility Differential” (RNUD) as a pivotal metric to facilitate the decision-making process for chatbot technology selection and resource distribution. Our findings reveal that when RNUD values for all chatbots fall within a specified range, the model efficiently determines the optimal resource allocations, providing clear analytical solutions for each technology. Additionally, we devised an algorithm for scenarios where RNUD values vary significantly, effectively isolating optimal solutions by excluding suboptimal choices. Numerical analysis confirms that this algorithm maintains robust performance and high computational efficiency, particularly when the chatbot count does not exceed 20. This efficiency persists across various distributions of chatbots’ technical attributes, and increasing the number of candidate chatbots generally enhances overall educational utility. This suggests that a diverse technological environment can lead to more tailored and effective educational interventions. Moreover, our study highlights a competitive interaction among chatbots: those with superior technical attributes tend to receive more resources. However, when the technical attributes of one chatbot improve, the resources allocated to others decrease, and vice versa. These insights underscore the importance of not only providing more sophisticated chatbots but also carefully managing their interactions to maximize overall educational utility.","2169-3536","","10.1109/ACCESS.2025.3530413","University Philosophy and Social Sciences Research Program of Jiangsu Education Department(grant numbers:2023SJYB0731); Higher Education Reform Research Project of Higher Education Association of Jiangsu Province(grant numbers:2023JSJG649); Scientific Research Foundation for High-Level Talents(grant numbers:RC2023-006); ","https://ieeexplore.ieee.org/stamp/stamp.jsp?arnumber=10843671","Chatbot technology;technology selection;resource allocation;mathematical modeling;higher education","Chatbots;Resource management;Education;Artificial intelligence;Electronic learning;Ethics;Solid modeling;Optimization models;Generative AI;Decision making","","2","","60","CCBYNCND","16 Jan 2025","","","IEEE","IEEE Journals"
"Exploring Metaverse Technologies in Entrepreneurship Through Machine Learning-Based Topic Modeling","K. Achuthan; S. Ramanathan; R. Raman","Center for Cybersecurity Systems & Networks, Amrita School of Engineering, Amrita Vishwa Vidyapeetham, Amritapuri, India; Amrita School of Engineering, Amrita Vishwa Vidyapeetham, Coimbatore, India; Amrita School of Business, Amrita Vishwa Vidyapeetham, Amritapuri, India",IEEE Access,"2 Jun 2025","2025","13","","93417","93438","This study investigates the integration of metaverse technologies into entrepreneurship, focusing on policy frameworks, practical applications, research directions, and educational strategies to promote innovation and enhance business operations. Utilizing the preferred reporting items for systematic reviews and meta-analyses (PRISMA) framework, BERTopic modeling identified four key thematic areas in the literature: virtual reality (VR) in entrepreneurial education, augmented reality (AR) and VR in tourism, metaverse technologies for business ventures, and digital transformation. The main findings include that in education, VR enhances skills through immersive experiences, whereas AR and VR enrich tourism. Metaverse technologies create new business opportunities and redefine traditional models. Digital transformation, spurred by global events, drives innovation across various sectors. Case studies exploring the metaverse’s benefits for entrepreneurship across industries, including NFTs and crypto ventures, healthcare, tourism, cultural engagement, and space exploration, are presented. These findings signify the potential of metaverse technologies in driving innovation and fostering entrepreneurial growth in education, tourism, business, and beyond. Additionally practical insights are offered into how immersive virtual technologies can transform entrepreneurial education and business models viewed from the lens of educators, policy makers, practitioners, and researchers while ensuring scalability and sustainability. A framework for future work in metaverse integration that touches on ethical standards, data privacy, and digital literacy to balance innovation with societal safeguards is presented.","2169-3536","","10.1109/ACCESS.2025.3567622","","https://ieeexplore.ieee.org/stamp/stamp.jsp?arnumber=10990215","Metaverse;entrepreneurship;augmented reality;virtual reality;generative AI;ethics;data privacy;digital transformation;topic modeling","Metaverse;Biological system modeling;Entrepreneurship;Technological innovation;Solid modeling;Data models;Predictive models;Industries;Economics;Ecosystems","","","","143","CCBY","7 May 2025","","","IEEE","IEEE Journals"
"Impact of Educational AI on Students' Studying Habits and Academic Performance","R. Khalkho; S. Singh; N. Gupta; P. Srivastava","BBA Department, Raj Kumar Goel Institute of Technology (CCS University), Ghaziabad, India; Department of Computer Applications, ABES Engineering College, Ghaziabad, Uttar Pradesh, India; BCA Department, Raj Kumar Goel Institute of Technology (CCS University), Ghaziabad, India; BBA Department, Raj Kumar Goel Institute of Technology (CCS University), Ghaziabad, India",2024 International Conference on Artificial Intelligence and Quantum Computation-Based Sensor Application (ICAIQSA),"21 Feb 2025","2024","","","1","6","The purpose of this research is to investigate how artificial intelligence (AI) affects students' academic experiences in terms of their study habits, academic achievement, social interactions, and emotional growth. While AI offers advantages such as increased accessibility to learning resources and personalized experiences, it also presents challenges. Through a questionnaire-based survey targeting teachers/Faculty members, this research aims to explore how AI influences learning behaviors and outcomes. This research will advance knowledge about artificial intelligence in education. This study explores the impact of artificial intelligence (AI), particularly learning platforms like ChatGPT, on students' academic experiences, focusing on study habits, academic achievement, social interactions, and emotional growth. By surveying 54 faculty members through a combination of multiple-choice and open-ended questions, the research employs both qualitative and quantitative methods to analyze the influence of AI in education. The findings reveal a dual-sided impact. While AI enhances academic performance through personalized learning and improved accessibility, it poses significant challenges. Overreliance on AI tools appears to hinder critical facets of student development, including study habits, emotional well-being, social interactions, and critical thinking. The convenience of AI risks fostering passive learning behaviors, reducing interpersonal communication, and promoting emotional and social detachment. This research underscores the need for a balanced approach to AI integration in education. To maximize benefits and mitigate drawbacks, educators and institutions must combine AI's potential with active teacher involvement, emphasizing critical thinking and social engagement. By treating AI as a supportive tool rather than a substitute for human educators, the long-term development of students can remain both positive and holistic.","","979-8-3315-1795-3","10.1109/ICAIQSA64000.2024.10882178","","https://ieeexplore.ieee.org/stamp/stamp.jsp?arnumber=10882178","Artificial Intelligence;Educational Management;Personalization of Learning;Creativity;Critical Thinking","Surveys;Quantum computing;Education;Focusing;Learning (artificial intelligence);Chatbots;Problem-solving;Artificial intelligence;Creativity","","1","","10","IEEE","21 Feb 2025","","","IEEE","IEEE Conferences"
"ChatWhiz: Chatbot Built Using Transformers and Gradio Framework","A. Sawant; S. Phadol; S. Mehere; P. Divekar; S. Khedekar; R. Dound","Department Of Information Technology, Vishwakarma Institute of Technology, Pune, India; Department Of Information Technology, Vishwakarma Institute of Technology, Pune, India; Department Of Information Technology, Vishwakarma Institute of Technology, Pune, India; Department Of Information Technology, Vishwakarma Institute of Technology, Pune, India; Department Of Information Technology, Vishwakarma Institute of Technology, Pune, India; Department Of Information Technology, Vishwakarma Institute of Technology, Pune, India",2024 5th International Conference on Intelligent Communication Technologies and Virtual Mobile Networks (ICICV),"7 May 2024","2024","","","454","461","The project “ChatWhiz: Chabot built using Transformers, and Gradio Framework” endeavors to develop an advanced and versatile Chabot system employing advanced transformer models. The objective is to craft a potent and adaptable chatbot solution that enriches user experiences and delivers practical benefits to businesses and organizations across various domains, from customer service to e-commerce. This project seeks to create a versatile and intelligent chatbot for the education sector, utilizing cutting-edge machine-learning models and frameworks to enhance student engagement, education management, and information dissemination. The chatbot is designed to provide a broad spectrum of functionalities, including curriculum-based content understanding, text summarization, text auto-completion, text generation, and interactive assessments. Leveraging these capabilities aims to offer users a seamless and efficient educational experience.","","979-8-3503-8564-9","10.1109/ICICV62344.2024.00077","","https://ieeexplore.ieee.org/stamp/stamp.jsp?arnumber=10511235","chatbot;Transformers;gradio;CNN;models","Adaptation models;Education;Transforms;Organizations;Machine learning;Transformers;Chatbots","","2","","15","IEEE","7 May 2024","","","IEEE","IEEE Conferences"
"Design and Implementation of a Comprehensive RAG-Driven Dashboard Within the ILO System for Data Visualization and Query Support: A Case Study of the University of Petra","M. Abu-Arqoub; A. Alkarim Banna; N. El-Khalili; M. Al-Shaikh Hasan","Department of Computer Science, University of Petra, Amman, Jordan; Data Science & Artificial Intelligence Dept., University of Petra, Amman, Jordan; Software Engineering Department, University of Petra, Amman, Jordan; Computer Science Department, Brunel University London, London, UK",2025 1st International Conference on Computational Intelligence Approaches and Applications (ICCIAA),"2 Jun 2025","2025","","","1","5","This article presents a comprehensive study on designing and implementing a dashboard for enhanced data visualization and query support at the University of Petra. The system leverages retrieval-augmented generation (RAG) and large language models (LLMs) to support diverse document types, including curricula, course descriptions, and program outcomes, alongside intended learning outcome (ILO)-related files. Our implementation demonstrates significant improvements in data accessibility and query response times while maintaining high accuracy in information retrieval and visualization. Through extensive evaluation, we show that this innovative approach transforms data management processes in higher education by enabling natural language interactions with educational data systems, building upon established business intelligence frameworks while introducing advanced AI capabilities.","","979-8-3315-2365-7","10.1109/ICCIAA65327.2025.11013578","","https://ieeexplore.ieee.org/stamp/stamp.jsp?arnumber=11013578","RAG;Learning Analytics;Data Visualization;Educational Technology;ILO System;Business Intelligence","Large language models;Retrieval augmented generation;Natural languages;Data visualization;Transforms;Educational technology;Information retrieval;Data systems;Business intelligence;Time factors","","","","19","IEEE","2 Jun 2025","","","IEEE","IEEE Conferences"
"Developing and Validating the Contextual Technology Andragogy/Pedagogy Entrepreneurship Work Content Knowledge Model: A Framework for Vocational Education","B. Younis","Department of Technology Education, Palestine Technical University-Kadoorie, Hebron, Palestine",IEEE Transactions on Education,"6 Feb 2025","2025","68","1","57","66","Purpose: The present study aimed to integrate artificial intelligence technology (ChatGPT) with an in-depth literature review to explore knowledge dimensions of professional teaching and information and communication technology (ICT) integration models in TVET, and utilize the Delphi technique and ChatGPT to examine, enhance, and validate a newly proposed model for professional teaching and ICT integration in TVET.Methods: Three rounds of the Delphi technique were applied to develop and validate this new model. Artificial intelligence tool (ChatGPT) with an in-depth literature review were used to explore knowledge dimensions for TVET education. In Round 1, ChatGPT was used to transform the technological pedagogical content knowledge (CK) model for TVET instruction. A new suggested model was developed called the contextual technology andrology/pedagogy entrepreneurship work CK (CTA/PEWCK) model. Ten experts from the TVET sector participated in Round 2, and 39 participated in Round 3 to validate the new suggested model.Findings: The findings revealed that the fifteen knowledge dimensions extracted from this new suggested model presented essential knowledge for TVET education.Conclusion: Applying the CTA/PEWCK model offers professional development opportunities for TVET teachers that focus on hands-on experiences to develop competencies for sustainable development (ESD), enabling an integrated approach to knowledge dimensions, procedures, and attitude.","1557-9638","","10.1109/TE.2024.3449636","","https://ieeexplore.ieee.org/stamp/stamp.jsp?arnumber=10676317","Artificial intelligence;contextual technology andrology/pedagogy entrepreneurship work content knowledge (CTA/PEWCK) model;Delphi technique;technological pedagogical content knowledge (TPACK) model;TWOCK model","Education;Entrepreneurship;Context modeling;Chatbots;Industries;Bibliographies;Standards","","","","55","IEEE","11 Sep 2024","","","IEEE","IEEE Journals"
"Context-Based Adaptive Multimodal Fusion Network for Continuous Frame-Level Sentiment Prediction","M. Huang; C. Qing; J. Tan; X. Xu","School of Electronic and Information Engineering, South China University of Technology, Guangzhou, China; School of Electronic and Information Engineering, South China University of Technology, Guangzhou, China; School of Electronic and Information Engineering, South China University of Technology, Guangzhou, China; School of Future Technology, South China University of Technology, Guangzhou, China","IEEE/ACM Transactions on Audio, Speech, and Language Processing","23 Oct 2023","2023","31","","3468","3477","Recently, video sentiment computing has become the focus of research because of its benefits in many applications such as digital marketing, education, healthcare, and so on. The difficulty of video sentiment prediction mainly lies in the regression accuracy of long-term sequences and how to integrate different modalities. In particular, different modalities may express different emotions. In order to maintain the continuity of long time-series sentiments and mitigate the multimodal conflicts, this article proposes a novel Context-Based Adaptive Multimodal Fusion Network (CAMFNet) for consecutive frame-level sentiment prediction. A Context-based Transformer (CBT) module was specifically designed to embed clip features into continuous frame features, leveraging its capability to enhance the consistency of prediction results. Moreover, to resolve the multi-modal conflict between modalities, this article proposed an Adaptive multimodal fusion (AMF) method based on the self-attention mechanism. It can dynamically determines the degree of shared semantics across modalities, enabling the model to flexibly adapt its fusion strategy. Through adaptive fusion of multimodal features, the AMF method effectively resolves potential conflicts arising from diverse modalities, ultimately enhancing the overall performance of the model. The proposed CAMFNet for consecutive frame-level sentiment prediction can ensure the continuity of long time-series sentiments. Extensive experiments illustrate the superiority of the proposed method especially in multimodal conflicts videos.","2329-9304","","10.1109/TASLP.2023.3321971","National Natural Science Foundation of China(grant numbers:61972163,U1801262); Natural Science Foundation of Guangdong Province(grant numbers:2022A1515011555,2023A1515012568); Guangdong Provincial Key Laboratory of Human Digital Twin(grant numbers:2022B1212010004); Pazhou Lab, Guangzhou, China; ","https://ieeexplore.ieee.org/stamp/stamp.jsp?arnumber=10271721","Video sentiment computing;multimodal fusion;context-based transformer;long-term features","Transformers;Feature extraction;Data mining;Annotations;Speech processing;Convolutional neural networks;Visualization","","4","","53","IEEE","4 Oct 2023","","","IEEE","IEEE Journals"
"Collaborating with Artificial Intelligence - AI in Business Communication Education","T. Kökuti; L. Balázs; I. András; M. Rajcsányi-Molnár","Institute of Social Sciences, University of Dunaújváros, Dunaújváros, Hungary; Institute of Social Sciences, University of Dunaújváros, Dunaújváros, Hungary; Institute of Social Sciences, University of Dunaújváros, Dunaújváros, Hungary; Institute of Social Sciences, University of Dunaújváros, Dunaújváros, Hungary",2023 IEEE 6th International Conference and Workshop Óbuda on Electrical and Power Engineering (CANDO-EPE),"7 Feb 2024","2023","","","000287","000294","Automation, robots, and artificial intelligence are becoming an integral part of our lives. These areas go hand in hand with the exponential development of some technical solutions. This study is partly about the future, but also provides a thematic mix of the present and contributes to the understanding of the paradigm shift in the use of artificial intelligence. The emergence of OpenAI ChatGPT is briefly presented as one of the latest achievements in the development of artificial intelligence. We then present some international studies on the impact of this innovative solution on the field of education. We will then seek answers to the following questions: Does artificial intelligence endanger the quality of education? Can students use it to solve problems? Has the development of artificial intelligence reached a level that could give rise to this concern? The present study explores the applicability of AI by focusing on the above issues. It does so through research conducted with the participation of university students, in which the focus is on the role of AI in the development of business communication education, skills, and operational processes. The students in the study were selected from undergraduate students in Communication and Media Studies and Business and Management.","2831-4506","979-8-3503-2875-2","10.1109/CANDO-EPE60507.2023.10417987","","https://ieeexplore.ieee.org/stamp/stamp.jsp?arnumber=10417987","artificial intelligence;business communication;education","Business communication;Surveys;Educational robots;Education;Artificial intelligence;Interviews;Business","","12","","39","IEEE","7 Feb 2024","","","IEEE","IEEE Conferences"
"Advancing Educational Management with the ATT-MR-WL Intelligent Question-Answering Model","Y. Ba","College of Civil and Architectural Engineering, North China University of Science and Technology, Tangshan, China",Journal of Web Engineering,"25 Dec 2024","2024","23","7","973","1002","Higher education plays a critical role in cultivating talent, preserving culture, and promoting social progress. However, current challenges, such as inefficient information dissemination and low problem-solving efficiency among students, highlight the need for intelligent question-answering systems. These systems, leveraging artificial intelligence and natural language processing technologies, enable rapid and accurate responses to student queries, thereby providing intelligent support for higher education management. This study introduces the ATT-MR-WL model, a generative AI system integrating Mask R-CNN and Word2Vec+LSTM to enhance intelligent question-answering functionality. The model, customized to handle both text and visual data, is evaluated using the established VQA v2.0 dataset and a specially developed EM dataset reflecting university management scenarios. The ATT-MR-WL model demonstrates a 3% accuracy improvement over traditional methods and enhances its ability to handle multimodal queries. This research provides important insights for enhancing the efficiency and quality of higher education management and advancing the process of educational informatization.","1544-5976","","10.13052/jwe1540-9589.2373","Hebei Provincial Department of Education(grant numbers:2023GJJG225); ","https://ieeexplore.ieee.org/stamp/stamp.jsp?arnumber=10815715","Intelligent question-answering;higher education management;Mask R-CNN;Word2Vec+LSTM;ATT-MR-WL","Analytical models;Visualization;Accuracy;Education;Robustness;Data models;Real-time systems;Question answering (information retrieval);Problem-solving;Context modeling","","","","35","","25 Dec 2024","","","River Publishers","River Publishers Journals"
