Document Title,Authors,Publication Title,Publication Year,Abstract,DOI,PDF Link
Study on the Role of Generative Artificial Intelligence in Advancing the Knowledge System of Traditional Chinese Medicine in Higher Education,"Li, Jingchao and Zhan, Meiwei and Li, Shanshan",Proceedings of the 2025 International Conference on Big Data and Informatization Education,2025,"The transfer and promotion of effectively inheritance and innovation of knowledge is a problem that higher education of Chinese medicine must face. This study provides a novel generative AI framework to promote the inheritance and innovative development of knowledge in traditional Chinese medical education. Utilizing multi-modal data processing (textual, visual and experiential) to construct a knowledge base, the model is based on Generative Adversarial Networks (GANs) and Transformer-based architecture. This context-aware and semantic-rich embedding is made possible using state-of-the-art technology, including attention mechanism and knowledge graph embedding. The learning structure of the model foreshadows the traditional Chinese medicine teaching model and cultivates students as good at in-depth understanding and creative application of knowledge. Furthermore, through transfer learning and domain-specific fine-tuning, the framework attains high fidelity of captured knowledge representation while also supporting the generation of new hypotheses and therapeutics. Our generative AI model improves knowledge transfer accuracy and depth, and encourage innovative thinking compared to traditional educational methodologies, as we demonstrate through experimental results.",10.1145/3729605.3729611,https://doi.org/10.1145/3729605.3729611
Integrating ChatGPT in Flipped Hospitality and Tourism Education Course Design: A Self-determination Theory Perspective,"Huang, Hui-Wen and Chang, Tsung-Shu",Proceedings of the 2024 8th International Conference on Digital Technology in Education (ICDTE),2024,"Existing literature indicates that the positive effects of flipped classrooms can enhance student engagement and learning outcomes. However, studies on the integration of AI chatbots in flipped teaching are scarce. The aim of this article is to contribute knowledge by infusing ChatGPT to demonstrate effective teaching strategies in flipped hospitality and tourism education (HTE). To enhance student motivation and engagement, I utilize self-determination theory (SDT) to serve as a theoretical framework in this innovative teaching approach. This approach includes structured teaching procedures over the learning process; real-time and personalized feedback provided by ChatGPT before class; in-class discussions between teacher-student and student-ChatGPT interactions; and after-class reflections to support student learning. Furthermore, based on SDT, ChatGPT interactions in the flipped classroom can stimulate student motivation and foster their autonomy, competence, and relatedness. Finally, HTE students will become engaging and independent learners through the scaffolded teaching structures provided by this article.",10.1145/3696230.3696237,https://doi.org/10.1145/3696230.3696237
Human-AI Collaboration in Software Engineering: Lessons Learned from a Hands-On Workshop,"Hamza, Muhammad and Siemon, Dominik and Akbar, Muhammad Azeem and Rahman, Tahsinur",Proceedings of the 7th ACM/IEEE International Workshop on Software-Intensive Business,2024,"This paper investigates the dynamics of human-AI collaboration in software engineering, focusing on the use of ChatGPT. Through a thematic analysis of a hands-on workshop in which 22 professional software engineers collaborated for three hours with ChatGPT, we explore the transition of AI from a mere tool to a collaborative partner. The study identifies key themes such as the evolving nature of human-AI interaction, the capabilities of AI in software engineering tasks, and the challenges and limitations of integrating AI in this domain. The findings show that while AI, particularly ChatGPT, improves the efficiency of code generation and optimization, human oversight remains crucial, especially in areas requiring complex problem-solving and security considerations. This research contributes to the theoretical understanding of human-AI collaboration in software engineering and provides practical insights for effectively integrating AI tools into development processes. It highlights the need for clear role allocation, effective communication, and balanced AI-human collaboration to realize the full potential of AI in software engineering.",10.1145/3643690.3648236,https://doi.org/10.1145/3643690.3648236
Transformative Approach to Fairness and Transparency in Classroom Participation Assessment,"Banawan, Michelle and Kukas, Elias John and Tano, John Richard and Tan, Adonna and Villegas, Ramil",,2024,"Building on a foundation of innovative Machine Learning and Artificial Intelligence (AI) applications, this study presents an evolved approach to assessing student class participation (CP) and providing timely feedback in Masters in Business Administration (MBA) programs. This approach has been rigorously applied and analyzed over the course of four academic terms, thereby offering a substantive examination of its effectiveness. The methodological framework of this study is predicated on the utilization of AI transcription tools, such as GRAIN, to convert Zoom session recordings into analyzable text data. This has enabled a consistent and objective evaluation of each student's contributions during class discussions across four subsequent terms. The implementation involved MBA students who shared similar professional backgrounds and demographics, ensuring a consistent context for analysis. AI-generated insights were integrated with a dynamic dashboard, presenting an innovative way to track and assess CP. These insights underwent meticulous annotation and review to guarantee adherence to the educational standards and fairness expected by the institution. The AI's role as an initial assessor was balanced by the professor's final judgement, forming a complementary relationship that enhanced the educational process. This study's findings are particularly noteworthy in the context of teaching quality and effectiveness. Over the four terms of implementation, student evaluations reflected high satisfaction with respect to fairness and respect in grading, the timeliness of feedback, and the adherence to established grading criteria. Notably, the ratings for these specific criteria consistently exceeded the term mean under the category of",10.1145/3657604.3664708,https://doi.org/10.1145/3657604.3664708
mobiCHAI - 1st International Workshop on Mobile Cognition-Altering Technologies (CAT) using Human-Centered AI,"ElAgroudy, Passant and Gruenerbl, Agnes and Barbareschi, Giulia and Spilski, Jan and Kunze, Kai and Lachmann, Thomas and Lukowicz, Paul",Adjunct Proceedings of the 26th International Conference on Mobile Human-Computer Interaction,2024,"The quest for enhanced cognition has been a driving force behind human advancement, fostering innovation and personal fulfillment. Cognition Altering Technologies (CAT) holds immense promise in elevating the quality of life across diverse domains including education, decision-making, healthcare, and fitness. The current proliferation of Artificial Intelligence (AI), particularly the widespread adoption of Generative AI and foundational models, presents an unprecedented opportunity to prototype new CAT that can augment human capabilities. This workshop aims to unite interdisciplinary research communities to explore the potential of leveraging GenAI and human-centered AI to develop relevant CAT. Taking place at MobileHCI 2024, this one-day workshop invites researchers, practitioners, and designers from fields such as artificial intelligence, ubiquitous computing, human-computer interaction, and social sciences to collaborate and chart the future of cognitive enhancement through technology.",10.1145/3640471.3680462,https://doi.org/10.1145/3640471.3680462
A Review of the Role and Impact of Generative Artificial Intelligence on Education,"Yang, Qi",Proceedings of the 2024 7th International Conference on Educational Technology Management,2025,"In order to ensure quality development in the age of intelligence, it is crucial to integrate intelligent technology with education. Artificial Intelligence (AI) and Generative Artificial Intelligence (GAI) are disruptive technologies in the area of education. While online education brings significant advantages in enhancing educational quality, promoting educational equity, and improving educational efficiency, it has also raised concerns among scholars around the world regarding students' moral ethics, cultivation of emotional values, technological dependence, thinking deprivation, privacy, and policy making. Using Cite Space software to analyze more than 50 articles from core journals in the field of educational technology at home and abroad, this paper comprehensively summarizes the role and impact of generative AI in education up to 2023, suggests the limitations of generative AI in empowering education at present, and predicts the direction scholars will tend to research in this field in the future.",10.1145/3711403.3711435,https://doi.org/10.1145/3711403.3711435
Context-Based Adaptive Multimodal Fusion Network for Continuous Frame-Level Sentiment Prediction,"Huang, Maochun and Qing, Chunmei and Tan, Junpeng and Xu, Xiangmin","IEEE/ACM Trans. Audio, Speech and Lang. Proc.",2023,"Recently, video sentiment computing has become the focus of research because of its benefits in many applications such as digital marketing, education, healthcare, and so on. The difficulty of video sentiment prediction mainly lies in the regression accuracy of long-term sequences and how to integrate different modalities. In particular, different modalities may express different emotions. In order to maintain the continuity of long time-series sentiments and mitigate the multimodal conflicts, this article proposes a novel Context-Based Adaptive Multimodal Fusion Network (CAMFNet) for consecutive frame-level sentiment prediction. A Context-based Transformer (CBT) module was specifically designed to embed clip features into continuous frame features, leveraging its capability to enhance the consistency of prediction results. Moreover, to resolve the multi-modal conflict between modalities, this article proposed an Adaptive multimodal fusion (AMF) method based on the self-attention mechanism. It can dynamically determines the degree of shared semantics across modalities, enabling the model to flexibly adapt its fusion strategy. Through adaptive fusion of multimodal features, the AMF method effectively resolves potential conflicts arising from diverse modalities, ultimately enhancing the overall performance of the model. The proposed CAMFNet for consecutive frame-level sentiment prediction can ensure the continuity of long time-series sentiments. Extensive experiments illustrate the superiority of the proposed method especially in multimodal conflicts videos.",10.1109/TASLP.2023.3321971,https://doi.org/10.1109/TASLP.2023.3321971
ChatGPT in Nutrition: Trends Challenges and Future Directions,"Tsiantis, Vasileios and Konstantinidis, Dimitrios and Dimitropoulos, Kosmas",Proceedings of the 17th International Conference on PErvasive Technologies Related to Assistive Environments,2024,"A healthy and balanced diet is of paramount importance to the physical and psychological well-being of an individual, since unhealthy dietary choices have been linked with the occurrence of non-communicable diseases. Recent technological advances has led to the development of large language models, such as ChatGPT that has been widely adopted as a convenient tool for creating meal plans and obtaining nutritional information. This work aims to provide a thorough review of the scientific work performed so far regarding the use of ChatGPT in the field of nutrition. In this survey, the advantages and limitations of ChatGPT in different aspects of nutrition are pinpointed, while the challenges from the use of ChatGPT in nutrition are identified and discussed. Future research directions are also proposed to assist researchers towards the development of more effective nutrition recommendation systems.",10.1145/3652037.3663898,https://doi.org/10.1145/3652037.3663898
Application analysis of generative artificial intelligence in basic education,"Qiu, Xiaoming and Zhang, Shu","Proceedings of the 2024 7th International Conference on E-Business, Information Management and Computer Science",2025,"This paper makes a detailed analysis of the application of Generative ARTIFICIAL intelligence in the field of basic education, and clarifies the existing problems, including the alienation of teaching process, the adaptation of teachers and students to new technologies, and the accuracy of content generation. And the empirical research is carried out on its specific application in the field of basic education, including questionnaire survey, data analysis and so on. By evaluating the changes in learning interest, learning performance and learning interaction between the control group and the experimental group, the potential and problems of generative AI application in the field of basic education are clarified. On this basis, this research draws the conclusion that the application of generative AI in the field of basic education also requires teachers to strengthen the emotional input, strengthen the technical training for teachers and students, and improve the accuracy of high content of education, so as to better cope with the challenges brought by technological change.",10.1145/3723420.3723428,https://doi.org/10.1145/3723420.3723428
CareerSim: Gamification Design Leveraging LLMs For Career Development Reflection,"Du, Wantong and Zhu, Zhiying and Xu, Xinhui and Che, Haoyuan and Chen, Shi",Extended Abstracts of the CHI Conference on Human Factors in Computing Systems,2024,"Graduates often struggle with challenges in their careers stemming from a lack of self-construction and decisive decision-making. The HCI community increasingly focuses on gamification as a means to foster reflection, with the emerging developments in LLM providing new opportunities for personalized gamified experiences. However, existing solutions fall short in terms of personalization and real-world data references. In response, our research introduces CareerSim, a role-playing game that leverages LLM’s generation and reasoning capabilities. By integrating these with real-world based databases and game mechanics, we delve into gamification’s role in reflective self-construction and decision-making. We aim to inspire designers to effectively incorporate LLMs in gamification design.",10.1145/3613905.3650928,https://doi.org/10.1145/3613905.3650928
Beyond Binary: Towards Fine-Grained LLM-Generated Text Detection via Role Recognition and Involvement Measurement,"Cheng, Zihao and Zhou, Li and Jiang, Feng and Wang, Benyou and Li, Haizhou",Proceedings of the ACM on Web Conference 2025,2025,"The rapid development of large language models (LLMs), like ChatGPT, has resulted in the widespread presence of LLM-generated content on social media platforms, raising concerns about misinformation, data biases, and privacy violations, which can undermine trust in online discourse. While detecting LLM-generated content is crucial for mitigating these risks, current methods often focus on binary classification, failing to address the complexities of real-world scenarios like human-LLM collaboration. To move beyond binary classification and address these challenges, we propose a new paradigm for detecting LLM-generated content. This approach introduces two novel tasks: LLM Role Recognition (LLM-RR), a multi-class classification task that identifies specific roles of an LLM in content generation, and LLM Involvement Measurement (LLM-IM), a regression task that quantifies the extent of LLM involvement in content creation. To support these tasks, we propose LLMDetect, a benchmark designed to evaluate detectors' performance on these new tasks. LLMDetect includes the Hybrid News Detection Corpus (HNDC) for training detectors, as well as DetectEval, a comprehensive evaluation suite that considers five distinct cross-context variations and two multi-intensity variations within the same LLM role. This allows for a thorough assessment of detectors' generalization and robustness across diverse contexts. Our empirical validation of 10 baseline detection methods demonstrates that fine-tuned Pre-trained Language Model (PLM)-based models consistently outperform others on both tasks, while advanced LLMs face challenges in accurately detecting their own generated content. Our experimental results and analysis offer insights for developing more effective detection models for LLM-generated content. This research enhances the understanding of LLM-generated content and establishes a foundation for more nuanced detection methodologies.",10.1145/3696410.3714770,https://doi.org/10.1145/3696410.3714770
Digital Human Techniques for Education Reform,"Guo, Peirong and Zhang, Qi and Tian, Chunwei and Xue, Wanli and Feng, Xiaocheng",Proceedings of the 2024 7th International Conference on Educational Technology Management,2025,"The rapid evolution of artificial intelligence, big data, and generative AI models has ushered in significant transformations across various sectors, including education. Digital Human Technique, an innovative technology grounded in advanced computer science and artificial intelligence, is reshaping educational paradigms by enabling virtual humans to simulate human behavior, express emotions, and interact with users. This paper explores the application of Digital Human Technique in education reform, focusing on creating immersive, intelligent classroom experiences that foster meaningful interactions between teachers and students. We define Digital Human Technique and delve into its key technical components such as character modeling and rendering, natural language processing, computer vision, and augmented reality technologies. Our methodology involves analyzing the role of educational digital humans created through these technologies, assessing their impact on educational processes, and examining various application scenarios in educational reform. Results indicate that Digital Human Technique significantly enhances the learning experience by enabling personalized teaching, increasing engagement, and fostering emotional connections. Educational digital humans serve as virtual teachers, interactive learning aids, and facilitators of emotional interaction, effectively addressing the challenges of traditional educational methods. They also promote a deeper understanding of complex concepts through simulated environments and interactive digital content.",10.1145/3711403.3711428,https://doi.org/10.1145/3711403.3711428
Is Human-AI Interaction CSCW?,,Companion Publication of the 2024 Conference on Computer-Supported Cooperative Work and Social Computing,2024,"As AI systems progress in their capabilities, Human-AI Collaboration is likely to become an increasingly prevalent paradigm in many domains, including business, education, entertainment, and social activities. Historically, only computer-mediated collaborations involving at least two people have been considered part of the field of study known as CSCW (computer-supported cooperative work). This panel will engage CSCW 2024 attendees with the controversial and timely question of whether the purview of CSCW should be expanded to include research on",10.1145/3678884.3689134,https://doi.org/10.1145/3678884.3689134
"An IS Research Agenda on Large Language Models: Development, Applications, and Impacts on Business and Management","Chau, Michael and Xu, Jennifer",ACM Trans. Manage. Inf. Syst.,2025,"Large language models have been advancing very rapidly and are making substantial impacts on all areas of business and management. We review the development of large language models and their applications in business and management, and identify the major issues and challenges faced by both practitioners and researchers. Based on our review, we propose an agenda for information systems researchers on large language models and discuss some of the potential directions for future research. Lastly, we present the articles in the special issue as exemplary research on large language models and discuss their implications.",10.1145/3713032,https://doi.org/10.1145/3713032
Is It Possible to Truly Understand Performance in LLMs?,"Greengard, Samuel",Commun. ACM,2024,"Seeking to understand when, and how, emergence takes place.",10.1145/3695860,https://doi.org/10.1145/3695860
AI Empowers the Construction of Marketing Courses in Application-Oriented Universities——From the Perspective of OBE Teaching Philosophy,"Tao, Si and Liu, Hua and Wang, Suyuan",Proceedings of the 2024 3rd International Conference on Artificial Intelligence and Education,2025,"In recent years, the disruptive development of Artificial Intelligence (AI) technology has triggered a series of industrial changes. How to cultivate the digital and intelligent literacy of students in marketing majors to meet the needs of marketing marketing is a huge challenge facing the marketing marketing course. In this context, based on the AI technology environment and from the perspective of OBE education philosophy, starting from the market's demand for graduates majoring in marketing, this article redesigns the teaching objectives, teaching content and methods, and teaching evaluation methods of marketing courses to cultivate modern intelligent marketing talents that meet market demand.",10.1145/3722237.3722279,https://doi.org/10.1145/3722237.3722279
ICAIE '24: Proceedings of the 2024 3rd International Conference on Artificial Intelligence and Education,,,2024,,,
Proceedings of the 2025 CHI Conference on Human Factors in Computing Systems,"Zhang, Xiaoyu and Xue, Fei and Albers, Alexander and Netland, Torbj\",Proceedings of the 2025 CHI Conference on Human Factors in Computing Systems,2025,"Serious games, particularly board games, have long been employed in production management education to teach various concepts. While they have demonstrated educational effectiveness, their integration with emerging Industry 4.0 technologies remains limited. Furthermore, there is a lack of empirical research on how industry practitioners apply these digitization technologies in the workplace. To bridge this gap, we designed a course that integrates digital technologies into a traditional board game. We conducted two studies to evaluate both knowledge gains within the classroom and knowledge transfer back into the manufacturing industry. Our results show an improved understanding of the synergies between production management principles and Industry 4.0 technologies, as well as the real-world challenges students face when attempting to transfer this knowledge. Our work contributes pedagogical and practical perspectives on how technology-enhanced serious games can extend learning in and beyond the classroom.",10.1145/3706598.3714169,https://doi.org/10.1145/3706598.3714169
ICETM '24: Proceedings of the 2024 7th International Conference on Educational Technology Management,,,2024,,,
Teaching AI Literacy for Innovation: Work in Progress,"Sengewald, Timon and Tremmel, Agnes",Proceedings of the 2024 Computers and People Research Conference,2024,"This study addresses the question of how AI literacy could be taught in higher education institutions so that students acquire appropriate competences and skills that will later support them in using AI tools effectively in innovation processes. We used a design science approach to derive learning archetypes to design a corresponding course curriculum. To evaluate these learning archetypes, we had students work on innovation projects in a course and allowed students to use AI tools without restriction. However, the students were required to clearly state how they utilized the AI tools to produce their results. The results indicate that students who were deeply engaged with AI tools outperformed their peers. However, two groups of students were identified who would require different approaches in a course curriculum to potentially increase their AI literacy. While the first group of students underestimated the abilities of AI tools for their given task, the second group overestimated the results and was too early satisfied with them, lacking a certain amount of curiosity.",10.1145/3632634.3655874,https://doi.org/10.1145/3632634.3655874
ACE '24: Proceedings of the 26th Australasian Computing Education Conference,,,2024,,,
DEIT '25: Proceedings of the 2025 International Conference on Digital Education and Information Technology,,,2025,,,
